{
  "$schema": "../../../../../schemas/compatibility-record-v2.schema.json",
  "schemaVersion": 2,
  "adapterId": "space-engineers-2",
  "slug": "space-engineers-2",
  "adapterVersion": "0.1.0",
  "game": {
    "product": "Space Engineers 2",
    "productVersion": "2.4.0.86",
    "steamBuildId": "24225486",
    "relevantAssemblies": {
      "Game2.Client.dll": {
        "fileVersion": "2.4.0.86",
        "sha256": "2615D1ECB0E257D0B305B35F7432B17B2804717972972F4AB01FD94F59E14415",
        "mvid": "ce896525-65d6-4eaa-af7d-11689b84e183"
      },
      "VRage.Core.dll": {
        "fileVersion": "2.4.0.86",
        "sha256": "AEE614E14F585B62027ABE654CF9C7358CFE3FA68D861A84C503909E3C8007FF",
        "mvid": "4ae89048-a8cf-44eb-9c9d-1a0919c56eff"
      },
      "VRage.Library.dll": {
        "fileVersion": "2.4.0.86",
        "sha256": "185D21A726CE9168EC8F5CC6B9640888D768F388C568FEB2C8D66B79B102BE8D",
        "mvid": "7d8de598-9a13-47e7-8d08-8793b7f82357"
      }
    },
    "buildIdentity": {
      "platform": "steam",
      "platformAppId": "1133870",
      "platformBuildId": "24225486",
      "productVersion": null,
      "isProductVersionMeaningful": false,
      "fingerprintBuildId": null
    }
  },
  "validation": {
    "date": "2026-08-24",
    "result": "tested",
    "automatedTests": "passed",
    "manualChecklist": "passed",
    "limitations": [
      "Experimental integration against Space Engineers 2 private runtime APIs. Revalidate after every game update."
    ]
  }
}
