{
  "$schema": "../../../../../schemas/compatibility-record-v2.schema.json",
  "schemaVersion": 2,
  "adapterId": "space-engineers-2",
  "slug": "space-engineers-2",
  "adapterVersion": "0.1.0",
  "game": {
    "product": "Space Engineers 2",
    "productVersion": "2.4.0.77",
    "steamBuildId": "24225482",
    "relevantAssemblies": {
      "Game2.Client.dll": {
        "fileVersion": "2.4.0.77",
        "sha256": "5BDD29A3B47D489A15CD1D56CA9CE51E3FFD0E70036E24C4E402FCB743BF9207",
        "mvid": "66bc4b13-de75-4cdb-8a79-3f952d390678"
      },
      "VRage.Core.dll": {
        "fileVersion": "2.4.0.77",
        "sha256": "62C051C900C8745044670633D38D7F194AB102F940B293BB8126397EFB8630B0",
        "mvid": "2eb0d3fc-1e52-4281-b872-05ee371c8e05"
      },
      "VRage.Library.dll": {
        "fileVersion": "2.4.0.77",
        "sha256": "9C83A2AE1CADD587004BBDD1055D573D3FA24AA24E8B1C624E7F9C8C34752F3A",
        "mvid": "a6b4f995-9cca-44ad-a7a2-1b060ba6e2ed"
      }
    },
    "buildIdentity": {
      "platform": "steam",
      "platformAppId": "1133870",
      "platformBuildId": "24225482",
      "productVersion": null,
      "isProductVersionMeaningful": false,
      "fingerprintBuildId": null
    }
  },
  "validation": {
    "date": "2026-08-19",
    "result": "tested",
    "automatedTests": "passed",
    "manualChecklist": "passed",
    "limitations": [
      "Experimental integration against Space Engineers 2 private runtime APIs. Revalidate after every game update."
    ]
  }
}
